{
  "id": "conf-atomic-rung-over-ceiling",
  "schema_version": "0.1",
  "claim": {
    "statement": "A pure-Python RUP checker cannot certify an atomic barrier at the stronger R2 rung.",
    "kind": "impossibility",
    "negation_of": "an atomic checker over-declared above its runner-owned ceiling",
    "scope": "one RUP certificate checked by rup-python"
  },
  "domain": "conformance/rung-ceiling",
  "rung": {
    "level": "R2",
    "name": "overdeclared-atomic",
    "trusted_base": ["this rung is intentionally too strong for rup-python"]
  },
  "certificate": {
    "kind": "lrat-flat",
    "path": "certs/samples_w33.cert",
    "sha256": "f280ae0847138a9e4332446de277ef9e870d27571d33b80d0b3a0f68a7aa4b7a",
    "meta": { "original_clauses": 615, "proof_steps": 6179 }
  },
  "artifacts": [
    {
      "id": "w33-cert",
      "type": "lrat-flat",
      "role": "certificate",
      "path": "certs/samples_w33.cert",
      "sha256": "f280ae0847138a9e4332446de277ef9e870d27571d33b80d0b3a0f68a7aa4b7a"
    }
  ],
  "checker": {
    "kind": "rup-python",
    "cert": "certs/samples_w33.cert"
  },
  "status": "live",
  "provenance": {
    "source_package": "barrier-atlas conformance",
    "pipeline": "valid checker and artifact but overdeclared rung"
  },
  "one_directional": "The runner refuses an atomic rung stronger than the checker kind can earn.",
  "expected_verdict": "REFUSED",
  "expected_reason_code": "RUNG_CEILING_EXCEEDED"
}
