{
  "id": "conf-sandbox-required-unavailable",
  "schema_version": "0.1",
  "claim": {
    "statement": "A checker that requires a real sandbox cannot certify when that sandbox profile is unavailable.",
    "kind": "impossibility",
    "negation_of": "certification by a plugin that requested a sandbox the runner could not provide",
    "scope": "one external plugin with requires_sandbox true"
  },
  "domain": "conformance/plugin",
  "rung": {
    "level": "R3",
    "name": "external-independent-recomputation",
    "trusted_base": ["runner sandbox availability check"]
  },
  "certificate": { "kind": "plugin-rup" },
  "artifacts": [
    {
      "id": "certificate",
      "type": "lrat-flat",
      "role": "certificate",
      "path": "certs/samples_w33.cert",
      "sha256": "f280ae0847138a9e4332446de277ef9e870d27571d33b80d0b3a0f68a7aa4b7a"
    }
  ],
  "checker": {
    "kind": "external-rup",
    "manifest": "spec/checkers/rup.manifest.json",
    "cert_artifact": "certificate",
    "requires_sandbox": true
  },
  "status": "live",
  "provenance": {
    "source_package": "barrier-atlas conformance",
    "pipeline": "runner refuses because a required real sandbox is unavailable in the portable profile"
  },
  "one_directional": "A required-but-unavailable sandbox degrades to unverifiable, never certified.",
  "expected_verdict": "UNVERIFIABLE-HERE",
  "expected_reason_code": "SANDBOX_UNAVAILABLE"
}
